{
  "title": {
    "ar": "محطة بحرية - بجاية",
    "en": "Maritime Station - Bejaia",
    "fr": "Station Maritime - Bejaia"
  },
  "category": {
    "ar": "مرافق بحرية",
    "en": "Maritime Facilities",
    "fr": "Installations Maritimes"
  },
  "description": {
    "ar": "تصميم محطة بحرية تجارية",
    "en": "Design of a commercial maritime station",
    "fr": "Conception d'une station maritime commerciale"
  },
  "coverImage": "/assets/img/project/maritime-station.jpg",
  "featured": true,
  "client": "Port Authority",
  "location": {
    "ar": "بجاية، الجزائر",
    "en": "Bejaia, Algeria",
    "fr": "Bejaia, Algérie"
  },
  "year": 2020
}
