{
  "title": {
    "ar": "مركز قيادة عسكري - قالمة",
    "en": "Military Command Center - Guelma",
    "fr": "Centre de Commandement Militaire - Guelma"
  },
  "category": {
    "ar": "مرافق عسكرية",
    "en": "Military Facilities",
    "fr": "Installations Militaires"
  },
  "description": {
    "ar": "تصميم مركز قيادة عسكري متكامل",
    "en": "Design of a complete military command center",
    "fr": "Conception d'un centre de commandement militaire complet"
  },
  "coverImage": "/assets/img/project/military-center.jpg",
  "featured": true,
  "client": "Ministry of Defense",
  "location": {
    "ar": "قالمة، الجزائر",
    "en": "Guelma, Algeria",
    "fr": "Guelma, Algérie"
  },
  "year": 2021
}
